<?xml version="1.0" encoding="UTF-8"?>
<!DOCTYPE catalogo SYSTEM "11.dtd">
<!--
To change this license header, choose License Headers in Project Properties.
To change this template file, choose Tools | Templates
and open the template in the editor.
-->


<catalogo 
    xmlns:xsi='http://www.w3.org/2001/XMLSchema-instance'
    xsi:noNamespaceSchemaLocation='Schema10.xsd'>
    <portatil>
        <referencia>HP12345</referencia>
        <nombre>HP 15-DA0204NS</nombre>
        <fabricante nombre="HP"/>
        <procesador>
            <nombre>Intel Core i3-7020U</nombre>
            <cache tamanyo="MB">500</cache>
            <nprocesadores>2</nprocesadores>
            <velocidad medida="GHz">2,3</velocidad>
        </procesador>
        <ram>
            <memoria medida="GB">8</memoria>
            <tipo>DDR4</tipo>
        </ram>
        <disco>
            <tipo>SSD</tipo>
            <capacidad medida="GB">500</capacidad>
        </disco>
        <pantalla>
            <dimension>27 pulgadas</dimension>
            <resolucion>1266x768</resolucion>
            <rmaxima>1366x768</rmaxima>
        </pantalla>
        <grafica>Nvidia GTX 720</grafica>
    </portatil>
    <portatil>
        <referencia>LE12345</referencia>
        <nombre>LENOVO IDEAPAD S145</nombre>
        <fabricante nombre="LENOVO"/>
        <procesador>
            <nombre>Intel Core i3-8145U</nombre>
            <cache tamanyo="MB">500</cache>
            <nprocesadores>1</nprocesadores>
            <velocidad medida="GHz">2,1</velocidad>
        </procesador>
        <ram>
            <memoria medida="GB">8</memoria>
            <tipo>DDR4</tipo>
        </ram>
        <disco>
            <tipo>HDD</tipo>
            <capacidad medida="TB">1</capacidad>
        </disco>
        <pantalla>
            <dimension>23 pulgadas</dimension>
             <resolucion>1266x768</resolucion>
        </pantalla>
        <grafica>Intel UHD Graphics 620</grafica>
    </portatil>
</catalogo>
